{
  "disturbance_uid":"dist_heat_001",
  "type":"heatwave",
  "start_time":"2026-07-15T00:00:00Z",
  "end_time":"2026-07-18T23:59:59Z",
  "severity_method_uid":"method-heatwave-threshold-v0.1",
  "severity_value":"synthetic",
  "spatial_scope":"ohe_sicily_genesis",
  "source_refs":["weather:synthetic"],
  "management_response_refs":[],
  "uncertainty":"synthetic fixture only"
}
